{
  "verification_id": "VER-1787928925695",
  "run_id": "RUN-TEST-VER-1",
  "status": "PASS",
  "timestamp": "2026-08-28T14:55:25.695Z",
  "verifier_type": "fresh_context",
  "requirements_checked": [
    {
      "requirement_id": "REQ-001",
      "status": "verified",
      "acceptance_criteria_passed": [
        "AC-001.1",
        "AC-001.2"
      ],
      "acceptance_criteria_failed": []
    }
  ],
  "evidence": {
    "tests_passed": 5,
    "tests_failed": 0,
    "test_suite_output": "PASS"
  }
}